{
  "schema_version": "2.1",
  "gate_version": "1.2.1",
  "phase": "DESIGN",
  "gate_result_date": "2026-10-04",
  "checked_by": "Codex - current plan content and input review 2026-10-04",
  "plan_sha256": "3cb29234e362218cb547865cdce856211873ae909d084859a48e2e8070f8c0d0",
  "references_checked": [
    {
      "key": "GATE_SPEC",
      "path": "standards/WEEKLY_PLAN_GATE.md",
      "sha256": "b57d647ce4a73413560c96f756a1ffda34b0ba65dcd936daf4d2d0c133f603f2"
    },
    {
      "key": "GOVERNING_DECISIONS",
      "path": "context/decisions.md",
      "sha256": "39e7a694cf46fa37d79d958e65651ea30cd0b789197633a47e4ce33770168daf"
    },
    {
      "key": "NOOR_ACTION_MAPPING",
      "path": "work/planning/term1/noor_action_mapping_review_2026-09-30.md",
      "sha256": "9b1cc02d55e40c6aa6f70966acf0ec6a945539799ecbdd85d4a30e87bc403600"
    },
    {
      "key": "NOOR_DECISION_MATRIX",
      "path": "catalog/records_noor_decision_matrix.json",
      "sha256": "71e78dd8c589e7398e981ba15388129d86b0e5248483946dd1f4b756e35d5c3e"
    },
    {
      "key": "NOOR_REFERENCE",
      "path": "references/03_official_operational_guides/noor/مرجع_نظام_نور_للتوجيه_الطلابي.md",
      "sha256": "870d1b98fb205746dc9a4bad36531a6eb25fa09fccdcb7e35f9e3b763dd0f5fc"
    },
    {
      "key": "ORGANIZATIONAL_GUIDE",
      "path": "references/02_regulatory/organizational_guides/الدليل التنظيمي - مقتطف التوجيه الطلابي 1446.pdf",
      "sha256": "fcb09f4b8b3ab720dc68684d077ab2de340ca8cbbd2742fd132003dd112babda"
    },
    {
      "key": "PROCEDURAL_GUIDE",
      "path": "references/02_regulatory/procedural_guides/الدليل الإجرائي الكامل - رجب 1446.pdf",
      "sha256": "9d37a896a6336c7e5f31f74b17bf1c5ccd3c638e7bc3ee8a1f1408a9d0102e8d"
    },
    {
      "key": "PROGRAM_REGISTRY",
      "path": "catalog/source_registry.json",
      "sha256": "958222b8be4b4054f80f012386716765012ed791d836e1cd6deaf635f59bea40"
    },
    {
      "key": "QASSIM_PLAN",
      "path": "references/04_regional_plans/خطة برامج وخدمات التوجيه الطلابي تعليم القصيم 1448.pdf",
      "sha256": "79e2198db34bb4f46985fbb50d27f27d24d98be4e15ecea92b6b38ba5e6f0fb9"
    },
    {
      "key": "SCHOOL_CONTEXT",
      "path": "context/current.json",
      "sha256": "bd37699b4c4da7c924931e431265025bf095db810f0fd8030ddff7c1127c6fa0"
    },
    {
      "key": "TERM1_MATRIX",
      "path": "work/planning/term1/مصفوفة_تنفيذ_الفصل_الأول.xlsx",
      "sha256": "e7d7609d6f9e669406e24b6d7d43d993c8ede8d354903848cf2ff4467676d826"
    },
    {
      "key": "TERM1_TIMING_LAYER",
      "path": "work/planning/term1/term1_eligibility_timing_decision_layer_1448.md",
      "sha256": "0ad17989d4e0a0e40ed792e0b132788541160e159750bd02c241ae9365772c41"
    }
  ],
  "results": [
    {
      "rule_id": "E01",
      "phase": "DESIGN",
      "result": "PASS",
      "information_status": "SUPPORTED",
      "evidence_type": "current DOCX content and approved operational inputs",
      "claim": "الأولوية الحالية مراجعة الاستحقاق وإغلاق توثيق المنفذ S040/S041/S051؛ لا برنامج رسمي جديد مفروض، والخدمات الحدثية عند السبب الفعلي. يستند التصميم إلى طبقة التوقيت المعتمدة ولا ينشئ استحقاق S016.",
      "locator": {
        "path": "outputs/weekly_plans/2026-10-04_to_2026-10-08/weekly_plan_2026-10-04_adhd.docx",
        "paragraph": 3,
        "text": "قرار الأسبوع: حُسم الاستحقاق من خطة القصيم 1448 وطبقة القرار التشغيلية. لا توجد نافذة زمنية ثابتة لبدء برنامج رسمي جديد في 4–8 أكتوبر؛ وما وضعته المصفوفة للتوجيه المهني في الأسبوعين 7–8 اختيار مدرسي، بينما المصدر يجعله متاحًا طوال العام. الأولوية هي مراجعة استحقاق الأسبوع وإغلاق توثيق ما نُفّذ فقط [S040، S041، S051]، وتفتح الخدمات الحدثية عند وقوع سببها الفعلي."
      },
      "reviewed_by": "Codex - current plan content and input review 2026-10-04",
      "reviewed_at": "2026-10-04T17:25:08.190923+00:00"
    },
    {
      "rule_id": "E02",
      "phase": "DESIGN",
      "result": "PASS",
      "information_status": "SUPPORTED",
      "evidence_type": "current DOCX content and approved operational inputs",
      "claim": "التصميم لموجه واحد في سياق المدرسة الحالي من current.json والصفوف 2–6؛ لا عدد مستفيدين فعلي قبل التنفيذ ولا نشاط لفئة غير منطبقة.",
      "locator": {
        "path": "outputs/weekly_plans/2026-10-04_to_2026-10-08/weekly_plan_2026-10-04_adhd.docx",
        "paragraph": 26,
        "text": "مساران لا ينتظران أولوية الأسبوع"
      },
      "reviewed_by": "Codex - current plan content and input review 2026-10-04",
      "reviewed_at": "2026-10-04T17:25:08.190923+00:00"
    },
    {
      "rule_id": "E03",
      "phase": "DESIGN",
      "result": "PASS",
      "information_status": "SUPPORTED",
      "evidence_type": "current DOCX content and approved operational inputs",
      "claim": "تقويم النسخة الحالية 4–8 أكتوبر و23–27 ربيع الآخر 1448، مع قاعدة تفسير 1447 المحدودة في طبقة التوقيت المعتمدة؛ نافذة المصفوفة توزيع مدرسي وليست استحقاقًا رسميًا جديدًا.",
      "locator": {
        "path": "outputs/weekly_plans/2026-10-04_to_2026-10-08/weekly_plan_2026-10-04_adhd.docx",
        "paragraph": 2,
        "text": "الأحد 4 أكتوبر إلى الخميس 8 أكتوبر 2026 | 23–27 ربيع الآخر 1448 | الدوام 7:00–11:00"
      },
      "reviewed_by": "Codex - current plan content and input review 2026-10-04",
      "reviewed_at": "2026-10-04T17:25:08.190923+00:00"
    },
    {
      "rule_id": "E04",
      "phase": "DESIGN",
      "result": "PASS",
      "information_status": "VERIFIED",
      "evidence_type": "current DOCX content and approved operational inputs",
      "claim": "الخطة تميز العمل المستمر والخدمة الحدثية عن البرنامج الرسمي، وتفسر طوال العام إتاحة عند الحاجة لا إعادة أسبوعية.",
      "locator": {
        "path": "outputs/weekly_plans/2026-10-04_to_2026-10-08/weekly_plan_2026-10-04_adhd.docx",
        "paragraph": 50,
        "text": "معنى «ينفذ طوال العام»: نافذة إتاحة للإجراء عند الحاجة أو وفق دوريته، لا أمر بإعادة البرنامج كاملًا كل أسبوع. تحدد خطة القصيم الاستحقاق والتوقيت، وتستخدم المصفوفة للتوزيع التشغيلي فقط. يحدد مسار نور من المطابقة المجمدة لرمز الإجراء المنفذ؛ ولا ينشأ لهذه الورقة الأسبوعية سجل مستقل، ولا يوثق شيء قبل التنفيذ الفعلي."
      },
      "reviewed_by": "Codex - current plan content and input review 2026-10-04",
      "reviewed_at": "2026-10-04T17:25:08.190923+00:00"
    },
    {
      "rule_id": "N01",
      "phase": "DESIGN",
      "result": "PASS",
      "information_status": "SUPPORTED",
      "evidence_type": "current DOCX content and approved operational inputs",
      "claim": "مسار نور يحدد للرمز المنفذ من المطابقة التشغيلية الحالية؛ الورقة الأسبوعية لا تنشئ سجلًا مستقلًا ولا تدعي وجود حقول أو حفظ قبل وقوع الخدمة.",
      "locator": {
        "path": "outputs/weekly_plans/2026-10-04_to_2026-10-08/weekly_plan_2026-10-04_adhd.docx",
        "paragraph": 50,
        "text": "معنى «ينفذ طوال العام»: نافذة إتاحة للإجراء عند الحاجة أو وفق دوريته، لا أمر بإعادة البرنامج كاملًا كل أسبوع. تحدد خطة القصيم الاستحقاق والتوقيت، وتستخدم المصفوفة للتوزيع التشغيلي فقط. يحدد مسار نور من المطابقة المجمدة لرمز الإجراء المنفذ؛ ولا ينشأ لهذه الورقة الأسبوعية سجل مستقل، ولا يوثق شيء قبل التنفيذ الفعلي."
      },
      "reviewed_by": "Codex - current plan content and input review 2026-10-04",
      "reviewed_at": "2026-10-04T17:25:08.190923+00:00"
    },
    {
      "rule_id": "N03",
      "phase": "DESIGN",
      "result": "PASS",
      "information_status": "PENDING",
      "evidence_type": "current DOCX content and approved operational inputs",
      "claim": "حقول الأعداد والمؤشرات فارغة إلى وقوع التنفيذ والقياس؛ لا نسبة أو قيمة أثر فعلية أو متوقعة معبأة.",
      "locator": {
        "path": "outputs/weekly_plans/2026-10-04_to_2026-10-08/weekly_plan_2026-10-04_adhd.docx",
        "paragraph": 110,
        "text": "عدد الأعمال المتحقق ظهورها: ..........  |  يحتاج تصحيحًا: .........."
      },
      "reviewed_by": "Codex - current plan content and input review 2026-10-04",
      "reviewed_at": "2026-10-04T17:25:08.190923+00:00"
    },
    {
      "rule_id": "V01",
      "phase": "DESIGN",
      "result": "PASS",
      "information_status": "VERIFIED",
      "evidence_type": "current DOCX content and approved operational inputs",
      "claim": "تفصل النسخة الحالية المنفذ الفعلي عن الشاهد والإغلاق؛ عدم وجود واقعة يغلق بلا اختلاق نشاط أو شاهد.",
      "locator": {
        "path": "outputs/weekly_plans/2026-10-04_to_2026-10-08/weekly_plan_2026-10-04_adhd.docx",
        "paragraph": 12,
        "text": "إذا لم يظهر عمل منفذ ينتظر الإغلاق ولا حالة فعلية، اكتب «لا ينطبق» وأغلق؛ لا تنشئ نشاطًا أو شاهدًا أو سجلًا."
      },
      "reviewed_by": "Codex - current plan content and input review 2026-10-04",
      "reviewed_at": "2026-10-04T17:25:08.190923+00:00"
    },
    {
      "rule_id": "V02",
      "phase": "DESIGN",
      "result": "PASS",
      "information_status": "SUPPORTED",
      "evidence_type": "current DOCX content and approved operational inputs",
      "claim": "تطلب الخطة الحد الأدنى للشاهد في موطنه الصحيح، ولا تساوي الصورة أو التقرير أثرًا؛ عند غياب عمل فعلي يثبت لا يوجد أو لا ينطبق.",
      "locator": {
        "path": "outputs/weekly_plans/2026-10-04_to_2026-10-08/weekly_plan_2026-10-04_adhd.docx",
        "paragraph": 40,
        "text": "الشاهد المهني الأقصر في موطن الحالة؛ ومسار نور هو الخدمة أو الإجراء المثبت للرمز في المطابقة المجمدة. إن لم تقع حالة: «لا ينطبق»."
      },
      "reviewed_by": "Codex - current plan content and input review 2026-10-04",
      "reviewed_at": "2026-10-04T17:25:08.190923+00:00"
    },
    {
      "rule_id": "P01",
      "phase": "DESIGN",
      "result": "PASS",
      "information_status": "VERIFIED",
      "evidence_type": "current DOCX content and approved operational inputs",
      "claim": "النسخة العامة بلا أسماء أو تفاصيل طلاب حساسة؛ صفحة التنفيذ تنص على الحفظ بلا أسماء أو تفاصيل حساسة.",
      "locator": {
        "path": "outputs/weekly_plans/2026-10-04_to_2026-10-08/weekly_plan_2026-10-04_adhd.docx",
        "paragraph": 53,
        "text": "تُستخدم بالقلم أثناء الأسبوع، ثم تحفظ بلا أسماء أو تفاصيل حساسة"